{
  "$schema": "https://json-schema.org/draft/2020-12/schema",
  "$id": "https://github.com/Emily2040/seedance-2.0/schemas/project-state.schema.json",
  "title": "Seedance Sequence Project State",
  "description": "Structural and record-local validation only. Graph-wide lineage semantics require project_state_check.py and continuity_chain_check.py.",
  "$comment": "JSON Schema cannot enforce clip-id uniqueness, parent existence, self-parent rejection, parent-before-child ordering, cycle freedom, or parent status/endpoint usability. Run both semantic validators.",
  "type": "object",
  "required": [
    "schema_version",
    "state_revision",
    "project_id",
    "project_mode",
    "surface",
    "clip_budget_sec",
    "prompt_budget",
    "story",
    "world_bible",
    "reference_registry",
    "scenes",
    "beats",
    "clips",
    "take_history",
    "current_clip_id",
    "canon_revision",
    "updated_at"
  ],
  "properties": {
    "schema_version": {"type": "string"},
    "state_revision": {"type": "integer", "minimum": 1},
    "project_id": {"type": "string", "minLength": 1},
    "project_mode": {"enum": ["standalone_clip", "sequence_project"]},
    "surface": {"type": "object"},
    "clip_budget_sec": {"type": ["number", "null"]},
    "prompt_budget": {"type": ["integer", "null"]},
    "story": {"$ref": "#/$defs/story"},
    "world_bible": {"type": "object"},
    "reference_registry": {"type": "array", "items": {"$ref": "#/$defs/reference"}},
    "scenes": {"type": "array", "items": {"$ref": "#/$defs/scene"}},
    "beats": {"type": "array", "items": {"$ref": "#/$defs/beat"}},
    "clips": {"type": "array", "items": {"$ref": "#/$defs/clip"}},
    "take_history": {
      "type": "array",
      "maxItems": 4096,
      "items": {"$ref": "#/$defs/take_history_item"}
    },
    "current_clip_id": {"type": "string"},
    "canon_revision": {"type": "integer", "minimum": 1},
    "updated_at": {"type": "string"}
  },
  "$defs": {
    "take_history_item": {
      "type": "object",
      "required": ["take_id", "clip_id", "verdict"],
      "additionalProperties": false,
      "properties": {
        "take_id": {
          "type": "string",
          "minLength": 1,
          "maxLength": 256,
          "pattern": "\\S"
        },
        "clip_id": {
          "type": "string",
          "minLength": 1,
          "maxLength": 256,
          "pattern": "\\S"
        },
        "verdict": {
          "enum": ["accept", "accept_with_deviation", "repair", "reject"]
        },
        "evidence": {"type": "string", "maxLength": 4096}
      }
    },
    "story": {
      "type": "object",
      "required": ["logline", "story_promise", "objective", "initial_condition", "final_outcome", "target_duration_sec", "tone", "medium"],
      "properties": {
        "logline": {"type": "string"},
        "story_promise": {"type": "string"},
        "objective": {"type": "string"},
        "initial_condition": {"type": "string"},
        "final_outcome": {"type": "string"},
        "target_duration_sec": {"type": ["number", "null"]},
        "tone": {"type": "string"},
        "medium": {"type": "string"}
      }
    },
    "reference": {
      "type": "object",
      "required": ["tag", "role", "preserve_exact_tag"],
      "properties": {
        "tag": {"type": "string", "minLength": 1},
        "role": {"type": "string"},
        "preserve_exact_tag": {"const": true}
      }
    },
    "scene": {
      "type": "object",
      "required": ["scene_id", "scene_index", "narrative_function", "arc_position", "location", "time_of_day", "anchor_source", "max_chain_depth", "audio_plan", "assigned_clip_ids", "transition_out", "status"],
      "properties": {
        "scene_id": {"type": "string"},
        "scene_index": {"type": "integer", "minimum": 1},
        "narrative_function": {"type": "string"},
        "arc_position": {"enum": ["open", "rising", "turn", "climax", "release"]},
        "location": {"type": "string"},
        "time_of_day": {"type": "string"},
        "anchor_source": {"type": "array", "items": {"type": "string"}},
        "max_chain_depth": {"type": "integer", "minimum": 0, "maximum": 3},
        "audio_plan": {"type": "string"},
        "assigned_clip_ids": {"type": "array", "items": {"type": "string"}, "uniqueItems": true},
        "transition_out": {"type": "string"},
        "status": {"enum": ["planned", "current", "completed", "omitted", "replaced"]}
      }
    },
    "beat": {
      "type": "object",
      "required": ["beat_id", "description", "narrative_function", "status", "assigned_clip_id", "dependencies"],
      "properties": {
        "beat_id": {"type": "string"},
        "description": {"type": "string"},
        "narrative_function": {"type": "string"},
        "status": {"enum": ["planned", "current", "completed", "omitted", "replaced"]},
        "assigned_clip_id": {"type": ["string", "null"]},
        "dependencies": {"type": "array", "items": {"type": "string"}}
      }
    },
    "clip": {
      "type": "object",
      "required": [
        "clip_id",
        "scene_id",
        "sequence_index",
        "prompt_version",
        "generation_mode",
        "status",
        "narrative_job",
        "felt_intent",
        "already_happened",
        "this_clip_only",
        "reserved_for_later",
        "planned_start_state",
        "planned_end_state",
        "observed_start_state",
        "observed_end_state",
        "continuity_locks",
        "allowed_changes",
        "continuity_breaks",
        "accepted_deviations",
        "transition_in",
        "transition_out",
        "open_motion_vectors",
        "handoff_requirements",
        "extension_depth"
      ],
      "properties": {
        "clip_id": {"type": "string", "minLength": 1, "maxLength": 256, "pattern": "\\S"},
        "parent_clip_id": {"type": ["string", "null"], "minLength": 1, "maxLength": 256, "pattern": "\\S"},
        "scene_id": {"type": "string"},
        "sequence_index": {"type": "integer", "minimum": 1},
        "prompt_version": {"type": "string"},
        "generation_mode": {"type": "string"},
        "source_clip_tag": {"type": ["string", "null"]},
        "status": {"enum": ["planned", "ready", "generated", "reviewed", "accepted", "accepted_with_deviation", "repair", "rejected"]},
        "narrative_job": {"type": "string"},
        "felt_intent": {"type": "string", "minLength": 1, "pattern": "\\S"},
        "already_happened": {"type": "array", "items": {"type": "string"}},
        "this_clip_only": {"type": "array", "items": {"type": "string"}},
        "reserved_for_later": {"type": "array", "items": {"type": "string"}},
        "planned_start_state": {"type": "object"},
        "planned_end_state": {"type": "object"},
        "observed_start_state": {"type": ["object", "null"]},
        "observed_end_state": {"type": ["object", "null"]},
        "continuity_locks": {"type": "array"},
        "allowed_changes": {"type": "array"},
        "continuity_breaks": {"type": "array"},
        "accepted_deviations": {"type": "array"},
        "transition_in": {"type": "string"},
        "transition_out": {"type": "string"},
        "open_motion_vectors": {"type": "array"},
        "handoff_requirements": {"type": "array"},
        "extension_depth": {"type": "integer", "minimum": 0}
      },
      "allOf": [
        {
          "if": {
            "properties": {"sequence_index": {"const": 1}},
            "required": ["sequence_index"]
          },
          "then": {
            "properties": {"parent_clip_id": {"type": "null"}}
          },
          "else": {
            "required": ["parent_clip_id"],
            "properties": {
              "parent_clip_id": {"type": "string", "minLength": 1, "pattern": "\\S"}
            }
          }
        },
        {
          "if": {
            "properties": {
              "status": {"enum": ["accepted", "accepted_with_deviation"]}
            },
            "required": ["status"]
          },
          "then": {
            "properties": {
              "observed_end_state": {"type": "object", "minProperties": 1}
            }
          }
        },
        {
          "if": {
            "properties": {"status": {"const": "rejected"}},
            "required": ["status"]
          },
          "then": {
            "properties": {"observed_end_state": {"type": "null"}}
          }
        }
      ]
    }
  }
}
