{
  "schema_version": "6.6.0",
  "state_revision": 2,
  "project_id": "seq_airport_arrival",
  "project_mode": "sequence_project",
  "surface": {
    "name": "unknown",
    "profile": "conservative_generic",
    "verified_at": null
  },
  "clip_budget_sec": null,
  "prompt_budget": null,
  "story": {
    "logline": "A traveler escapes the airport crowd and reaches a waiting car.",
    "story_promise": "A tense arrival resolves into a clean getaway.",
    "objective": "Move the traveler from terminal exit to vehicle departure without losing screen direction.",
    "initial_condition": "The traveler exits the terminal into rain and crowd pressure.",
    "final_outcome": "The car pulls away into traffic after the traveler is safely inside.",
    "target_duration_sec": 45,
    "tone": "tense but controlled",
    "medium": "live_action"
  },
  "world_bible": {
    "location": "airport curbside pickup lane in light rain",
    "screen_direction": "traveler moves left-to-right",
    "vehicle_identity": "black sedan with rear passenger door",
    "persistent_environment": "glass terminal doors, wet curb, taxi lights",
    "character_specific_object": "creased paper airline tag looped around the suitcase handle",
    "character_specific_object_provenance": "authored_choice"
  },
  "reference_registry": [
    {
      "tag": "@Image 1",
      "role": "canonical traveler identity and wardrobe",
      "preserve_exact_tag": true
    },
    {
      "tag": "[Video 1]",
      "role": "accepted Clip 01 continuity source",
      "preserve_exact_tag": true
    }
  ],
  "scenes": [
    {
      "scene_id": "scene_01",
      "scene_index": 1,
      "narrative_function": "Complete the arrival handoff from terminal exit to vehicle departure.",
      "arc_position": "release",
      "location": "airport arrivals curb",
      "time_of_day": "daytime",
      "anchor_source": [
        "@Image 1"
      ],
      "max_chain_depth": 2,
      "audio_plan": "Clips carry curb ambience and sync SFX; score is unified in post.",
      "assigned_clip_ids": [
        "clip_01",
        "clip_02",
        "clip_03"
      ],
      "transition_out": "cut to black",
      "status": "current"
    }
  ],
  "beats": [
    {
      "beat_id": "beat_terminal_exit",
      "description": "Traveler exits the terminal into curbside rain.",
      "narrative_function": "establish pressure",
      "status": "completed",
      "assigned_clip_id": "clip_01",
      "dependencies": []
    },
    {
      "beat_id": "beat_reach_car",
      "description": "Traveler reaches the open rear door.",
      "narrative_function": "finish approach",
      "status": "current",
      "assigned_clip_id": "clip_02",
      "dependencies": [
        "beat_terminal_exit"
      ]
    },
    {
      "beat_id": "beat_enter_car",
      "description": "Traveler gets into the car and closes the door.",
      "narrative_function": "secure escape",
      "status": "planned",
      "assigned_clip_id": "clip_02",
      "dependencies": [
        "beat_reach_car"
      ]
    },
    {
      "beat_id": "beat_departure",
      "description": "Vehicle leaves the crowd and disappears into traffic.",
      "narrative_function": "resolution",
      "status": "planned",
      "assigned_clip_id": "clip_03",
      "dependencies": [
        "beat_enter_car"
      ]
    }
  ],
  "clips": [
    {
      "clip_id": "clip_01",
      "parent_clip_id": null,
      "scene_id": "scene_01",
      "sequence_index": 1,
      "prompt_version": "6.6.0",
      "generation_mode": "T2V",
      "source_clip_tag": null,
      "status": "accepted_with_deviation",
      "narrative_job": "Exit terminal and approach the open rear car door.",
      "felt_intent": "The viewer notices that her pace never changes even when the waiting car comes within reach.",
      "directors_read_lane": "narrative",
      "authoring_state": {
        "dramatic_function": "Advance arrival to the threshold of shelter without pretending the traveler reached it.",
        "turn": "Public endurance at the terminal becomes shelter within two steps while exposure continues.",
        "pov": "The traveler; the waiting car holds her gaze but remains visibly unreached at the accepted endpoint.",
        "power_shift": "Rain and curb traffic still control her exposed movement; the car has not yet become her boundary.",
        "hidden_want_objective": "Reach the waiting car without letting the curbside crowd see how exhausted she is.",
        "obstacle_tactic": "The exposed curb, rain, and rolling suitcase invite a hurried release; she keeps one measured tempo and fixes her eyes on the open door.",
        "subtext_contradiction": "The car promises relief, but the accepted take leaves her still performing public endurance.",
        "visible_suppressed_behavior": "At a curb seam, her thumb hooks beneath the creased airline tag, then releases it without looking down.",
        "non_transferable_detail": "A creased paper airline tag looped around the suitcase handle catches under her thumb at a curb seam.",
        "non_transferable_detail_provenance": "authored_choice",
        "non_transferable_detail_source": null,
        "stock_solution_refused": "No relieved smile, sagging shoulders, or backward glance; replace them with the thumb catching and releasing the tag while her pace stays even.",
        "value_before": "arrival is public endurance with shelter still distant",
        "value_after": "shelter is within two steps while public endurance continues",
        "prompt_carriers": [
          "She sees the open rear door but keeps the same measured walking tempo.",
          "At a curb seam, her thumb hooks beneath the creased airline tag, then releases it without looking down.",
          "She remains two steps from the open rear door, mid-stride, with her face and shoulders held level."
        ]
      },
      "contract_authoring_state_snapshots": [
        {
          "project_id": "seq_airport_arrival",
          "clip_id": "clip_01",
          "canon_revision": 1,
          "state_revision": 1,
          "authoring_state_sha256": "d71f3ea0b9c44d243b102b396cce28b83d921582f5fc409eb3209a82257aa045"
        }
      ],
      "already_happened": [],
      "this_clip_only": [
        "beat_terminal_exit",
        "beat_reach_car"
      ],
      "reserved_for_later": [
        "beat_enter_car",
        "beat_departure"
      ],
      "planned_start_state": {
        "character": {
          "canonical_identity_id": "traveler_from_@Image 1",
          "wardrobe": "charcoal coat, small black suitcase",
          "location": "inside terminal threshold",
          "position_in_frame": "left third",
          "pose": "walking out",
          "travel_direction": "left-to-right",
          "motion_vector": "steady walk toward curb",
          "emotional_state": "focused"
        },
        "environment": {
          "persistent_environment": "glass terminal doors, wet curb, taxi lights",
          "vehicle_identity": "black sedan with rear passenger door",
          "lighting_phase": "cool rain reflections"
        },
        "camera": {
          "camera_phase": "tracking beside traveler",
          "focus_state": "traveler and open door"
        },
        "audio": {
          "audio_phase": "airport curb ambience, no completed dialogue"
        },
        "reference_tags": [
          "@Image 1"
        ]
      },
      "planned_end_state": {
        "character": {
          "canonical_identity_id": "traveler_from_@Image 1",
          "wardrobe": "charcoal coat, small black suitcase",
          "location": "beside open rear car door",
          "position_in_frame": "center right",
          "pose": "hand near door frame",
          "travel_direction": "left-to-right",
          "motion_vector": "slowing to stop at door",
          "emotional_state": "focused"
        },
        "environment": {
          "persistent_environment": "glass terminal doors, wet curb, taxi lights",
          "vehicle_identity": "black sedan with rear passenger door",
          "lighting_phase": "cool rain reflections"
        },
        "camera": {
          "camera_phase": "tracking ends near rear door",
          "focus_state": "traveler and open door"
        },
        "audio": {
          "audio_phase": "airport curb ambience, no completed dialogue"
        },
        "reference_tags": [
          "@Image 1"
        ]
      },
      "observed_start_state": {
        "character": {
          "canonical_identity_id": "traveler_from_@Image 1",
          "wardrobe": "charcoal coat, small black suitcase",
          "location": "inside terminal threshold",
          "position_in_frame": "left third",
          "pose": "walking out",
          "travel_direction": "left-to-right",
          "motion_vector": "steady walk toward curb",
          "emotional_state": "focused"
        },
        "environment": {
          "persistent_environment": "glass terminal doors, wet curb, taxi lights",
          "vehicle_identity": "black sedan with rear passenger door",
          "lighting_phase": "cool rain reflections"
        },
        "camera": {
          "camera_phase": "tracking beside traveler",
          "focus_state": "traveler and open door"
        },
        "audio": {
          "audio_phase": "airport curb ambience, no completed dialogue"
        },
        "reference_tags": [
          "@Image 1"
        ]
      },
      "observed_end_state": {
        "character": {
          "canonical_identity_id": "traveler_from_@Image 1",
          "wardrobe": "charcoal coat, small black suitcase",
          "location": "two steps from the open rear car door",
          "position_in_frame": "center right",
          "pose": "mid-stride with suitcase rolling behind",
          "travel_direction": "left-to-right",
          "motion_vector": "continues two steps toward open door",
          "emotional_state": "focused"
        },
        "environment": {